14:59:31.802161 IP 127.0.0.1 > 127.0.0.1: ICMP echo request, id 87, seq 137, length 9
E.......@.|..............W...
14:59:31.803833 IP 127.0.0.1 > 127.0.0.1: ICMP echo request, id 104, seq 195, length 9
E.......@.|...........u..h...
14:59:31.804761 IP 127.0.0.1 > 127.0.0.1: ICMP echo request, id 97, seq 96, length 9
E.......@.|............>.a.`W
14:59:31.805735 IP 127.0.0.1 > 127.0.0.1: ICMP echo request, id 116, seq 20, length 9
E.......@.|............w.t...
14:59:31.806618 IP 127.0.0.1 > 127.0.0.1: ICMP echo request, id 32, seq 97, length 9
E.......@.|............~. .au
14:59:31.807446 IP 127.0.0.1 > 127.0.0.1: ICMP echo request, id 97, seq 29, length 9
E.......@.|..............a...
14:59:31.808280 IP 127.0.0.1 > 127.0.0.1: ICMP echo request, id 32, seq 22, length 9
E.......@.|.............. ...
14:59:31.809128 IP 127.0.0.1 > 127.0.0.1: ICMP echo request, id 109, seq 81, length 9
E.......@.|............A.m.Q.
14:59:31.810113 IP 127.0.0.1 > 127.0.0.1: ICMP echo request, id 101, seq 198, length 9
E.......@.|...........0..e...
14:59:31.810591 IP 127.0.0.1 > 127.0.0.1: ICMP echo request, id 115, seq 108, length 9
E.......@.|............ .s.lJ
14:59:31.811057 IP 127.0.0.1 > 127.0.0.1: ICMP echo request, id 115, seq 59, length 9
E.......@.|............Q.s.;.
14:59:31.811528 IP 127.0.0.1 > 127.0.0.1: ICMP echo request, id 44, seq 127, length 9
E.......@.|............T.,...
14:59:31.812059 IP 127.0.0.1 > 127.0.0.1: ICMP echo request, id 32, seq 105, length 9
E.......@.|...........Dv. .i.
14:59:31.812639 IP 127.0.0.1 > 127.0.0.1: ICMP echo request, id 121, seq 23, length 9
E.......@.|............o.y...
14:59:31.813374 IP 127.0.0.1 > 127.0.0.1: ICMP echo request, id 111, seq 147, length 9
E.......@.|...........R..o...
14:59:31.814072 IP 127.0.0.1 > 127.0.0.1: ICMP echo request, id 117, seq 4, length 9
E.......@.|..............u..G
14:59:31.814770 IP 127.0.0.1 > 127.0.0.1: ICMP echo request, id 32, seq 55, length 9
E.......@.|...........{.. .7|
14:59:31.815467 IP 127.0.0.1 > 127.0.0.1: ICMP echo request, id 119, seq 191, length 9
E.......@.|..............w...
14:59:31.816153 IP 127.0.0.1 > 127.0.0.1: ICMP echo request, id 105, seq 106, length 9
E.......@.|............,.i.j.
14:59:31.816833 IP 127.0.0.1 > 127.0.0.1: ICMP echo request, id 108, seq 114, length 9
E.......@.|............!.l.r.
14:59:31.817513 IP 127.0.0.1 > 127.0.0.1: ICMP echo request, id 108, seq 178, length 9
E.......@.|..............l...
14:59:31.818261 IP 127.0.0.1 > 127.0.0.1: ICMP echo request, id 32, seq 24, length 9
E.......@.|.............. ...
14:59:31.819012 IP 127.0.0.1 > 127.0.0.1: ICMP echo request, id 110, seq 182, length 9
E.......@.|...........	..n...
14:59:31.819862 IP 127.0.0.1 > 127.0.0.1: ICMP echo request, id 101, seq 146, length 9
E.......@.|...........&..e...
14:59:31.820566 IP 127.0.0.1 > 127.0.0.1: ICMP echo request, id 101, seq 129, length 9
E.......@.|..............e...
14:59:31.821278 IP 127.0.0.1 > 127.0.0.1: ICMP echo request, id 100, seq 140, length 9
E.......@.|..............d..
14:59:31.821963 IP 127.0.0.1 > 127.0.0.1: ICMP echo request, id 32, seq 194, length 9
E.......@.|.............. ..
14:59:31.822691 IP 127.0.0.1 > 127.0.0.1: ICMP echo request, id 116, seq 35, length 9
E.......@.|............h.t.#.
14:59:31.823307 IP 127.0.0.1 > 127.0.0.1: ICMP echo request, id 111, seq 171, length 9
E.......@.|..............o...
14:59:31.823759 IP 127.0.0.1 > 127.0.0.1: ICMP echo request, id 32, seq 121, length 9
E.......@.|............f. .y.
14:59:31.824202 IP 127.0.0.1 > 127.0.0.1: ICMP echo request, id 114, seq 123, length 9
E.......@.|...........)..r.{.
14:59:31.824668 IP 127.0.0.1 > 127.0.0.1: ICMP echo request, id 101, seq 38, length 9
E.......@.|............t.e.&I
14:59:31.825143 IP 127.0.0.1 > 127.0.0.1: ICMP echo request, id 111, seq 152, length 9
E.......@.|..............o../
14:59:31.825551 IP 127.0.0.1 > 127.0.0.1: ICMP echo request, id 114, seq 80, length 9
E.......@.|...........s=.r.P.
14:59:31.825959 IP 127.0.0.1 > 127.0.0.1: ICMP echo request, id 100, seq 133, length 9
E.......@.|..............d..c
14:59:31.826355 IP 127.0.0.1 > 127.0.0.1: ICMP echo request, id 101, seq 205, length 9
E.......@.|..............e...
14:59:31.826750 IP 127.0.0.1 > 127.0.0.1: ICMP echo request, id 114, seq 48, length 9
E.......@.|............\.r.0.
14:59:31.827158 IP 127.0.0.1 > 127.0.0.1: ICMP echo request, id 32, seq 155, length 9
E.......@.|............D. ...
14:59:31.827664 IP 127.0.0.1 > 127.0.0.1: ICMP echo request, id 101, seq 179, length 9
E.......@.|..............e...
14:59:31.828059 IP 127.0.0.1 > 127.0.0.1: ICMP echo request, id 118, seq 157, length 9
E.......@.|...........o..v...
14:59:31.828448 IP 127.0.0.1 > 127.0.0.1: ICMP echo request, id 101, seq 56, length 9
E.......@.|............b.e.8n
14:59:31.828838 IP 127.0.0.1 > 127.0.0.1: ICMP echo request, id 114, seq 189, length 9
E.......@.|..............r...
14:59:31.829227 IP 127.0.0.1 > 127.0.0.1: ICMP echo request, id 121, seq 180, length 9
E.......@.|..............y..E
14:59:31.829616 IP 127.0.0.1 > 127.0.0.1: ICMP echo request, id 116, seq 186, length 9
E.......@.|..............t..Z
14:59:31.830006 IP 127.0.0.1 > 127.0.0.1: ICMP echo request, id 104, seq 151, length 9
E.......@.|..............h...
14:59:31.830402 IP 127.0.0.1 > 127.0.0.1: ICMP echo request, id 105, seq 184, length 9
E.......@.|..............i...
14:59:31.830791 IP 127.0.0.1 > 127.0.0.1: ICMP echo request, id 110, seq 162, length 9
E.......@.|..............n...
14:59:31.831185 IP 127.0.0.1 > 127.0.0.1: ICMP echo request, id 103, seq 26, length 9
E.......@.|............~.g...
14:59:31.831579 IP 127.0.0.1 > 127.0.0.1: ICMP echo request, id 32, seq 126, length 9
E.......@.|............a. .~[
14:59:31.832003 IP 127.0.0.1 > 127.0.0.1: ICMP echo request, id 116, seq 175, length 9
E.......@.|..............t...
14:59:31.832403 IP 127.0.0.1 > 127.0.0.1: ICMP echo request, id 111, seq 18, length 9
E.......@.|............~.o...
14:59:31.832815 IP 127.0.0.1 > 127.0.0.1: ICMP echo request, id 32, seq 47, length 9
E.......@.|.............. ./n
14:59:31.833211 IP 127.0.0.1 > 127.0.0.1: ICMP echo request, id 103, seq 213, length 9
E.......@.|...........t..g...
14:59:31.833695 IP 127.0.0.1 > 127.0.0.1: ICMP echo request, id 101, seq 160, length 9
E.......@.|..............e...
14:59:31.834110 IP 127.0.0.1 > 127.0.0.1: ICMP echo request, id 116, seq 116, length 9
E.......@.|...........G..t.t.
14:59:31.834498 IP 127.0.0.1 > 127.0.0.1: ICMP echo request, id 32, seq 32, length 9
E.......@.|.............. . Z
14:59:31.834886 IP 127.0.0.1 > 127.0.0.1: ICMP echo request, id 116, seq 25, length 9
E.......@.|............r.t...
14:59:31.835311 IP 127.0.0.1 > 127.0.0.1: ICMP echo request, id 104, seq 115, length 9
E.......@.|............$.h.sR
14:59:31.835711 IP 127.0.0.1 > 127.0.0.1: ICMP echo request, id 101, seq 69, length 9
E.......@.|............U.e.E.
14:59:31.836102 IP 127.0.0.1 > 127.0.0.1: ICMP echo request, id 32, seq 78, length 9
E.......@.|.............. .N.
14:59:31.836500 IP 127.0.0.1 > 127.0.0.1: ICMP echo request, id 112, seq 54, length 9
E.......@.|............Y.p.6.
14:59:31.836899 IP 127.0.0.1 > 127.0.0.1: ICMP echo request, id 114, seq 50, length 9
E.......@.|............[.r.2.
14:59:31.837294 IP 127.0.0.1 > 127.0.0.1: ICMP echo request, id 105, seq 21, length 9
E.......@.|..............i...
14:59:31.837687 IP 127.0.0.1 > 127.0.0.1: ICMP echo request, id 99, seq 15, length 9
E.......@.|..............c..D
14:59:31.838129 IP 127.0.0.1 > 127.0.0.1: ICMP echo request, id 101, seq 28, length 9
E.......@.|............~.e...
14:59:31.838533 IP 127.0.0.1 > 127.0.0.1: ICMP echo request, id 87, seq 144, length 9
E.......@.|..............W...
14:59:31.838930 IP 127.0.0.1 > 127.0.0.1: ICMP echo request, id 104, seq 1, length 9
E.......@.|...........n..h...
14:59:31.839325 IP 127.0.0.1 > 127.0.0.1: ICMP echo request, id 97, seq 46, length 9
E.......@.|............p.a...
14:59:31.839812 IP 127.0.0.1 > 127.0.0.1: ICMP echo request, id 116, seq 120, length 9
E.......@.|...........&..t.x.
14:59:31.840205 IP 127.0.0.1 > 127.0.0.1: ICMP echo request, id 32, seq 57, length 9
E.......@.|.............. .9	
14:59:31.840591 IP 127.0.0.1 > 127.0.0.1: ICMP echo request, id 97, seq 190, length 9
E.......@.|..............a...
14:59:31.841052 IP 127.0.0.1 > 127.0.0.1: ICMP echo request, id 32, seq 45, length 9
E.......@.|...........f.. .-.
14:59:31.841496 IP 127.0.0.1 > 127.0.0.1: ICMP echo request, id 109, seq 58, length 9
E.......@.|............X.m.:.
14:59:31.841941 IP 127.0.0.1 > 127.0.0.1: ICMP echo request, id 101, seq 14, length 9
E.......@.|..............e..H
14:59:31.842587 IP 127.0.0.1 > 127.0.0.1: ICMP echo request, id 115, seq 40, length 9
E.......@.|............d.s.(A
14:59:31.843305 IP 127.0.0.1 > 127.0.0.1: ICMP echo request, id 115, seq 124, length 9
E.......@.|..............s.|.
14:59:31.843992 IP 127.0.0.1 > 127.0.0.1: ICMP echo request, id 44, seq 104, length 9
E.......@.|............k.,.h.
14:59:31.844677 IP 127.0.0.1 > 127.0.0.1: ICMP echo request, id 32, seq 49, length 9
E.......@.|.............. .1.
14:59:31.845364 IP 127.0.0.1 > 127.0.0.1: ICMP echo request, id 121, seq 183, length 9
E.......@.|..............y..9
14:59:31.846047 IP 127.0.0.1 > 127.0.0.1: ICMP echo request, id 111, seq 158, length 9
E.......@.|..............o...
14:59:31.846730 IP 127.0.0.1 > 127.0.0.1: ICMP echo request, id 117, seq 141, length 9
E.......@.|..............u...
14:59:31.847234 IP 127.0.0.1 > 127.0.0.1: ICMP echo request, id 32, seq 153, length 9
E.......@.|............F. ..@
14:59:31.847681 IP 127.0.0.1 > 127.0.0.1: ICMP echo request, id 119, seq 89, length 9
E.......@.|............/.w.Y.
14:59:31.848252 IP 127.0.0.1 > 127.0.0.1: ICMP echo request, id 105, seq 39, length 9
E.......@.|............o.i.'D
14:59:31.848658 IP 127.0.0.1 > 127.0.0.1: ICMP echo request, id 108, seq 192, length 9
E.......@.|...........G..l...
14:59:31.849066 IP 127.0.0.1 > 127.0.0.1: ICMP echo request, id 108, seq 117, length 9
E.......@.|..............l.u.
14:59:31.849513 IP 127.0.0.1 > 127.0.0.1: ICMP echo request, id 32, seq 76, length 9
E.......@.|...........<.. .L.
14:59:31.849909 IP 127.0.0.1 > 127.0.0.1: ICMP echo request, id 110, seq 19, length 9
E.......@.|............~.n...
14:59:31.850300 IP 127.0.0.1 > 127.0.0.1: ICMP echo request, id 101, seq 125, length 9
E.......@.|..............e.}:
14:59:31.850698 IP 127.0.0.1 > 127.0.0.1: ICMP echo request, id 101, seq 150, length 9
E.......@.|..............e...
14:59:31.851089 IP 127.0.0.1 > 127.0.0.1: ICMP echo request, id 100, seq 187, length 9
E.......@.|...........)..d...
14:59:31.851488 IP 127.0.0.1 > 127.0.0.1: ICMP echo request, id 32, seq 168, length 9
E.......@.|............7. ..Y
14:59:31.851877 IP 127.0.0.1 > 127.0.0.1: ICMP echo request, id 116, seq 53, length 9
E.......@.|............V.t.5.
14:59:31.852272 IP 127.0.0.1 > 127.0.0.1: ICMP echo request, id 111, seq 130, length 9
E.......@.|..............o...
14:59:31.852679 IP 127.0.0.1 > 127.0.0.1: ICMP echo request, id 32, seq 204, length 9
E.......@.|.............. ...
14:59:31.853076 IP 127.0.0.1 > 127.0.0.1: ICMP echo request, id 114, seq 41, length 9
E.......@.|............d.r.)T
14:59:31.853466 IP 127.0.0.1 > 127.0.0.1: ICMP echo request, id 101, seq 210, length 9
E.......@.|...........H..e...
14:59:31.853858 IP 127.0.0.1 > 127.0.0.1: ICMP echo request, id 111, seq 159, length 9
E.......@.|..............o...
14:59:31.854341 IP 127.0.0.1 > 127.0.0.1: ICMP echo request, id 114, seq 212, length 9
E.......@.|..............r..`
14:59:31.854727 IP 127.0.0.1 > 127.0.0.1: ICMP echo request, id 100, seq 206, length 9
E.......@.|..............d..I
14:59:31.855112 IP 127.0.0.1 > 127.0.0.1: ICMP echo request, id 101, seq 68, length 9
E.......@.|............V.e.D.
14:59:31.855499 IP 127.0.0.1 > 127.0.0.1: ICMP echo request, id 114, seq 73, length 9
E.......@.|............D.r.I.
14:59:31.855927 IP 127.0.0.1 > 127.0.0.1: ICMP echo request, id 32, seq 138, length 9
E.......@.|............U. ...
14:59:31.856319 IP 127.0.0.1 > 127.0.0.1: ICMP echo request, id 101, seq 196, length 9
E.......@.|..............e..5
14:59:31.856707 IP 127.0.0.1 > 127.0.0.1: ICMP echo request, id 118, seq 67, length 9
E.......@.|...........WF.v.C.
14:59:31.857100 IP 127.0.0.1 > 127.0.0.1: ICMP echo request, id 101, seq 71, length 9
E.......@.|...........?S.e.G.
14:59:31.857492 IP 127.0.0.1 > 127.0.0.1: ICMP echo request, id 114, seq 52, length 9
E.......@.|...........kY.r.4.
14:59:31.857916 IP 127.0.0.1 > 127.0.0.1: ICMP echo request, id 121, seq 185, length 9
E.......@.|..............y..8
14:59:31.858319 IP 127.0.0.1 > 127.0.0.1: ICMP echo request, id 116, seq 36, length 9
E.......@.|............g.t.$.
14:59:31.858773 IP 127.0.0.1 > 127.0.0.1: ICMP echo request, id 104, seq 156, length 9
E.......@.|...........~..h..x
14:59:31.859378 IP 127.0.0.1 > 127.0.0.1: ICMP echo request, id 105, seq 122, length 9
E.......@.|..............i.z.
14:59:31.860022 IP 127.0.0.1 > 127.0.0.1: ICMP echo request, id 110, seq 66, length 9
E.......@.|...........4O.n.B.
14:59:31.860797 IP 127.0.0.1 > 127.0.0.1: ICMP echo request, id 103, seq 72, length 9
E.......@.|............P.g.H.
14:59:31.861641 IP 127.0.0.1 > 127.0.0.1: ICMP echo request, id 32, seq 9, length 9
E.......@.|.............. .	.
14:59:31.862047 IP 127.0.0.1 > 127.0.0.1: ICMP echo request, id 116, seq 82, length 9
E.......@.|............8.t.R.
14:59:31.862445 IP 127.0.0.1 > 127.0.0.1: ICMP echo request, id 111, seq 145, length 9
E.......@.|...........#..o...
14:59:31.863042 IP 127.0.0.1 > 127.0.0.1: ICMP echo request, id 32, seq 181, length 9
E.......@.|............*. ...
14:59:31.863755 IP 127.0.0.1 > 127.0.0.1: ICMP echo request, id 103, seq 199, length 9
E.......@.|..............g..k
14:59:31.864494 IP 127.0.0.1 > 127.0.0.1: ICMP echo request, id 101, seq 95, length 9
E.......@.|............;.e._.
14:59:31.864942 IP 127.0.0.1 > 127.0.0.1: ICMP echo request, id 116, seq 84, length 9
E.......@.|............7.t.T.
14:59:31.865342 IP 127.0.0.1 > 127.0.0.1: ICMP echo request, id 32, seq 37, length 9
E.......@.|...........[.. .%.
14:59:31.865736 IP 127.0.0.1 > 127.0.0.1: ICMP echo request, id 116, seq 90, length 9
E.......@.|............1.t.Z]
14:59:31.866129 IP 127.0.0.1 > 127.0.0.1: ICMP echo request, id 104, seq 119, length 9
E.......@.|............ .h.w.
14:59:31.866521 IP 127.0.0.1 > 127.0.0.1: ICMP echo request, id 101, seq 201, length 9
E.......@.|..............e...
14:59:31.866912 IP 127.0.0.1 > 127.0.0.1: ICMP echo request, id 32, seq 188, length 9
E.......@.|............#. ...
14:59:31.867303 IP 127.0.0.1 > 127.0.0.1: ICMP echo request, id 112, seq 98, length 9
E.......@.|............-.p.b.
14:59:31.867693 IP 127.0.0.1 > 127.0.0.1: ICMP echo request, id 114, seq 93, length 9
E.......@.|............0.r.].
14:59:31.868127 IP 127.0.0.1 > 127.0.0.1: ICMP echo request, id 105, seq 65, length 9
E.......@.|............U.i.A.
14:59:31.869160 IP 127.0.0.1 > 127.0.0.1: ICMP echo request, id 99, seq 79, length 9
E.......@.|............M.c.O.
14:59:31.869942 IP 127.0.0.1 > 127.0.0.1: ICMP echo request, id 101, seq 64, length 9
E.......@.|............Z.e.@.
14:59:31.870703 IP 127.0.0.1 > 127.0.0.1: ICMP echo request, id 87, seq 136, length 9
E.......@.|...........x .W...
14:59:31.871450 IP 127.0.0.1 > 127.0.0.1: ICMP echo request, id 104, seq 92, length 9
E.......@.|............;.h.\?
14:59:31.872149 IP 127.0.0.1 > 127.0.0.1: ICMP echo request, id 97, seq 142, length 9
E.......@.|..............a...
14:59:31.872817 IP 127.0.0.1 > 127.0.0.1: ICMP echo request, id 116, seq 107, length 9
E.......@.|...........
 .t.k.
14:59:31.873375 IP 127.0.0.1 > 127.0.0.1: ICMP echo request, id 32, seq 3, length 9
E.......@.|.............. ..N
14:59:31.873807 IP 127.0.0.1 > 127.0.0.1: ICMP echo request, id 97, seq 177, length 9
E.......@.|..............a..?
14:59:31.874222 IP 127.0.0.1 > 127.0.0.1: ICMP echo request, id 32, seq 167, length 9
E.......@.|............8. ..,
14:59:31.874622 IP 127.0.0.1 > 127.0.0.1: ICMP echo request, id 109, seq 10, length 9
E.......@.|..............m.
.
14:59:31.875021 IP 127.0.0.1 > 127.0.0.1: ICMP echo request, id 101, seq 118, length 9
E.......@.|............$.e.v.
14:59:31.875418 IP 127.0.0.1 > 127.0.0.1: ICMP echo request, id 115, seq 33, length 9
E.......@.|...........Uk.s.!.
14:59:31.875818 IP 127.0.0.1 > 127.0.0.1: ICMP echo request, id 115, seq 27, length 9
E.......@.|............q.s...
14:59:31.876214 IP 127.0.0.1 > 127.0.0.1: ICMP echo request, id 44, seq 166, length 9
E.......@.|............-.,...
14:59:31.876606 IP 127.0.0.1 > 127.0.0.1: ICMP echo request, id 32, seq 172, length 9
E.......@.|............3. ...
14:59:31.877102 IP 127.0.0.1 > 127.0.0.1: ICMP echo request, id 121, seq 164, length 9
E.......@.|..............y...
14:59:31.877492 IP 127.0.0.1 > 127.0.0.1: ICMP echo request, id 111, seq 12, length 9
E.......@.|..............o..
14:59:31.877880 IP 127.0.0.1 > 127.0.0.1: ICMP echo request, id 117, seq 203, length 9
E.......@.|..............u...
14:59:31.878472 IP 127.0.0.1 > 127.0.0.1: ICMP echo request, id 32, seq 51, length 9
E.......@.|.............. .3h
14:59:31.878919 IP 127.0.0.1 > 127.0.0.1: ICMP echo request, id 119, seq 110, length 9
E.......@.|...........[..w.n.
14:59:31.879319 IP 127.0.0.1 > 127.0.0.1: ICMP echo request, id 105, seq 132, length 9
E.......@.|..............i...
14:59:31.879720 IP 127.0.0.1 > 127.0.0.1: ICMP echo request, id 108, seq 44, length 9
E.......@.|............g.l.,.
14:59:31.880118 IP 127.0.0.1 > 127.0.0.1: ICMP echo request, id 108, seq 174, length 9
E.......@.|..............l...
14:59:31.880585 IP 127.0.0.1 > 127.0.0.1: ICMP echo request, id 32, seq 8, length 9
E.......@.|.............. ..

14:59:31.880981 IP 127.0.0.1 > 127.0.0.1: ICMP echo request, id 110, seq 77, length 9
E.......@.|............D.n.M(
14:59:31.881420 IP 127.0.0.1 > 127.0.0.1: ICMP echo request, id 101, seq 208, length 9
E.......@.|..............e..N
14:59:31.881926 IP 127.0.0.1 > 127.0.0.1: ICMP echo request, id 101, seq 17, length 9
E.......@.|..............e...
14:59:31.882393 IP 127.0.0.1 > 127.0.0.1: ICMP echo request, id 100, seq 91, length 9
E.......@.|........... @.d.[.
14:59:31.882851 IP 127.0.0.1 > 127.0.0.1: ICMP echo request, id 32, seq 102, length 9
E.......@.|............y. .f.
14:59:31.883250 IP 127.0.0.1 > 127.0.0.1: ICMP echo request, id 116, seq 42, length 9
E.......@.|............a.t.*x
14:59:31.883746 IP 127.0.0.1 > 127.0.0.1: ICMP echo request, id 111, seq 134, length 9
E.......@.|............
.o...
14:59:31.884136 IP 127.0.0.1 > 127.0.0.1: ICMP echo request, id 32, seq 62, length 9
E.......@.|.............. .>.
14:59:31.884521 IP 127.0.0.1 > 127.0.0.1: ICMP echo request, id 114, seq 149, length 9
E.......@.|..............r...
14:59:31.884941 IP 127.0.0.1 > 127.0.0.1: ICMP echo request, id 101, seq 88, length 9
E.......@.|............A.e.X.
14:59:31.885346 IP 127.0.0.1 > 127.0.0.1: ICMP echo request, id 111, seq 13, length 9
E.......@.|..............o.I
14:59:31.886025 IP 127.0.0.1 > 127.0.0.1: ICMP echo request, id 114, seq 207, length 9
E.......@.|..............r..E
14:59:31.886885 IP 127.0.0.1 > 127.0.0.1: ICMP echo request, id 100, seq 113, length 9
E.......@.|............*.d.q4
14:59:31.887539 IP 127.0.0.1 > 127.0.0.1: ICMP echo request, id 101, seq 139, length 9
E.......@.|..............e...
14:59:31.887959 IP 127.0.0.1 > 127.0.0.1: ICMP echo request, id 114, seq 173, length 9
E.......@.|..............r..X
14:59:31.888355 IP 127.0.0.1 > 127.0.0.1: ICMP echo request, id 32, seq 99, length 9
E.......@.|............|. .c.
14:59:31.888750 IP 127.0.0.1 > 127.0.0.1: ICMP echo request, id 101, seq 165, length 9
E.......@.|...........z..e..|
14:59:31.889257 IP 127.0.0.1 > 127.0.0.1: ICMP echo request, id 118, seq 63, length 9
E.......@.|............J.v.? 
14:59:31.889658 IP 127.0.0.1 > 127.0.0.1: ICMP echo request, id 101, seq 34, length 9
E.......@.|............x.e.".
14:59:31.890060 IP 127.0.0.1 > 127.0.0.1: ICMP echo request, id 114, seq 128, length 9
E.......@.|...........?..r...
14:59:31.890455 IP 127.0.0.1 > 127.0.0.1: ICMP echo request, id 121, seq 163, length 9
E.......@.|..............y..+
14:59:31.890970 IP 127.0.0.1 > 127.0.0.1: ICMP echo request, id 116, seq 131, length 9
E.......@.|..............t..Z
14:59:31.891367 IP 127.0.0.1 > 127.0.0.1: ICMP echo request, id 104, seq 209, length 9
E.......@.|..............h..D
14:59:31.891921 IP 127.0.0.1 > 127.0.0.1: ICMP echo request, id 105, seq 75, length 9
E.......@.|............K.i.K8
14:59:31.892560 IP 127.0.0.1 > 127.0.0.1: ICMP echo request, id 110, seq 202, length 9
E.......@.|..............n...
14:59:31.893209 IP 127.0.0.1 > 127.0.0.1: ICMP echo request, id 103, seq 11, length 9
E.......@.|..............g...
14:59:31.893625 IP 127.0.0.1 > 127.0.0.1: ICMP echo request, id 32, seq 109, length 9
E.......@.|............r. .m.
14:59:31.894025 IP 127.0.0.1 > 127.0.0.1: ICMP echo request, id 116, seq 6, length 9
E.......@.|..............t..

14:59:31.894429 IP 127.0.0.1 > 127.0.0.1: ICMP echo request, id 111, seq 16, length 9
E.......@.|..............o..R
14:59:31.894826 IP 127.0.0.1 > 127.0.0.1: ICMP echo request, id 32, seq 94, length 9
E.......@.|.............. .^.
14:59:31.895237 IP 127.0.0.1 > 127.0.0.1: ICMP echo request, id 103, seq 169, length 9
E.......@.|..............g...
14:59:31.895697 IP 127.0.0.1 > 127.0.0.1: ICMP echo request, id 101, seq 200, length 9
E.......@.|..............e...
14:59:31.896096 IP 127.0.0.1 > 127.0.0.1: ICMP echo request, id 116, seq 101, length 9
E.......@.|............&.t.eq
14:59:31.896507 IP 127.0.0.1 > 127.0.0.1: ICMP echo request, id 32, seq 170, length 9
E.......@.|.........../5. ...
14:59:31.897084 IP 127.0.0.1 > 127.0.0.1: ICMP echo request, id 116, seq 100, length 9
E.......@.|............'.t.d@
14:59:31.897764 IP 127.0.0.1 > 127.0.0.1: ICMP echo request, id 104, seq 103, length 9
E.......@.|............0.h.g.
14:59:31.898674 IP 127.0.0.1 > 127.0.0.1: ICMP echo request, id 101, seq 193, length 9
E.......@.|...........I..e...
14:59:31.899442 IP 127.0.0.1 > 127.0.0.1: ICMP echo request, id 32, seq 70, length 9
E.......@.|.............. .F.
14:59:31.900165 IP 127.0.0.1 > 127.0.0.1: ICMP echo request, id 112, seq 135, length 9
E.......@.|...........4..p...
14:59:31.900889 IP 127.0.0.1 > 127.0.0.1: ICMP echo request, id 114, seq 61, length 9
E.......@.|............P.r.=5
14:59:31.901619 IP 127.0.0.1 > 127.0.0.1: ICMP echo request, id 105, seq 86, length 9
E.......@.|...........$@.i.V.
14:59:31.902349 IP 127.0.0.1 > 127.0.0.1: ICMP echo request, id 99, seq 7, length 9
E.......@.|..............c...
14:59:31.902793 IP 127.0.0.1 > 127.0.0.1: ICMP echo request, id 101, seq 60, length 9
E.......@.|.........../^.e.<.
14:59:31.903197 IP 127.0.0.1 > 127.0.0.1: ICMP echo request, id 87, seq 87, length 9
E.......@.|............Q.W.W.
14:59:31.903688 IP 127.0.0.1 > 127.0.0.1: ICMP echo request, id 104, seq 111, length 9
E.......@.|............(.h.o.
14:59:31.904389 IP 127.0.0.1 > 127.0.0.1: ICMP echo request, id 97, seq 5, length 9
E.......@.|..............a..
14:59:31.905068 IP 127.0.0.1 > 127.0.0.1: ICMP echo request, id 116, seq 211, length 9
E.......@.|..............t..B
14:59:31.905779 IP 127.0.0.1 > 127.0.0.1: ICMP echo request, id 32, seq 43, length 9
E.......@.|...........[.. .+.
14:59:31.906500 IP 127.0.0.1 > 127.0.0.1: ICMP echo request, id 97, seq 2, length 9
E.......@.|..............a..P
14:59:31.907227 IP 127.0.0.1 > 127.0.0.1: ICMP echo request, id 32, seq 85, length 9
E.......@.|.............. .U.
14:59:31.907945 IP 127.0.0.1 > 127.0.0.1: ICMP echo request, id 109, seq 31, length 9
E.......@.|............s.m...
14:59:31.908803 IP 127.0.0.1 > 127.0.0.1: ICMP echo request, id 101, seq 176, length 9
E.......@.|..............e...
14:59:31.909514 IP 127.0.0.1 > 127.0.0.1: ICMP echo request, id 115, seq 197, length 9
E.......@.|..............s...
14:59:31.910177 IP 127.0.0.1 > 127.0.0.1: ICMP echo request, id 115, seq 154, length 9
E.......@.|..............s...
14:59:31.910871 IP 127.0.0.1 > 127.0.0.1: ICMP echo request, id 44, seq 74, length 9
E.......@.|..............,.J.
14:59:31.911590 IP 127.0.0.1 > 127.0.0.1: ICMP echo request, id 32, seq 161, length 9
E.......@.|............>. ..5
14:59:31.912304 IP 127.0.0.1 > 127.0.0.1: ICMP echo request, id 121, seq 112, length 9
E.......@.|..............y.p.
14:59:31.913055 IP 127.0.0.1 > 127.0.0.1: ICMP echo request, id 111, seq 30, length 9
E.......@.|...........yr.o..~
14:59:31.913788 IP 127.0.0.1 > 127.0.0.1: ICMP echo request, id 117, seq 143, length 9
E.......@.|.........../..u...
14:59:31.914505 IP 127.0.0.1 > 127.0.0.1: ICMP echo request, id 32, seq 83, length 9
E.......@.|.............. .S.
14:59:31.915217 IP 127.0.0.1 > 127.0.0.1: ICMP echo request, id 119, seq 148, length 9
E.......@.|..............w...
